<?xml version="1.0" ?>
<!DOCTYPE actions SYSTEM "action-list.dtd">
<actions>

	<!--
		WORKSPACE GRAPH
	-->
	
	<!-- Load Dummy Graph -->
	<action id="replaydh.ui.core.workflowGraph.loadDummyGraph"
		name="${id}.name" desc="${id}.description" icon="icons8-bug-40.png" />
	
	<!-- Refresh Graph -->
	<action id="replaydh.ui.core.workflowGraph.refreshGraph"
		name="${id}.name" desc="${id}.description" icon="refresh.gif" help="true" />
	
	<!-- Change Active Step -->
	<action id="replaydh.ui.core.workflowGraph.changeActiveStep"
		name="${id}.name" desc="${id}.description" icon="navi_down.png" help="true" />
	
	<!-- Focus Active Step -->
	<action id="replaydh.ui.core.workflowGraph.focusActiveStep"
		name="${id}.name" desc="${id}.description" icon="compress.gif" help="true" />
		
	<!-- Compress Step -->
	<action id="replaydh.ui.core.workflowGraph.compressStep"
		name="${id}.name" desc="${id}.description" icon="collapseall.gif" help="true" />
		
	<!-- Expand Step -->
	<action id="replaydh.ui.core.workflowGraph.expandStep"
		name="${id}.name" desc="${id}.description" icon="expandall.gif" help="true" />
		
	<!-- Export Step Metadata -->
	<action id="replaydh.ui.core.workflowGraph.exportStepMetadata"
		name="${id}.name" desc="${id}.description" icon="externalize.gif" help="true" />
		
	<!-- Export Step Resources -->
	<action id="replaydh.ui.core.workflowGraph.exportStepResources"
		name="${id}.name" desc="${id}.description" icon="export_wiz.gif" help="true" />
		
	<!-- Export Metadata -->
	<action id="replaydh.ui.core.workflowGraph.exportMetadata"
		name="${id}.name" desc="${id}.description" icon="externalize.gif" help="true" />
		
	<!-- Export Resources -->
	<action id="replaydh.ui.core.workflowGraph.exportResources"
		name="${id}.name" desc="${id}.description" icon="export_wiz.gif" help="true" />
		
	<!-- Import Repository -->
	<action id="replaydh.ui.core.workflowGraph.updateRepository"
		name="${id}.name" desc="${id}.description" icon="import_wiz.gif" help="true" />
		
	<!-- Publish Resources -->
	<!-- 
		<action id="replaydh.ui.core.workflowGraph.publishResources"
		name="${id}.name" desc="${id}.description" icon="icons8-epub-40.png"/>
	 -->
	
	<!-- Toggle Compress Pipes -->
	<action id="replaydh.ui.core.workflowGraph.toggleCompressPipes"
		name="${id}.name" desc="${id}.description" icon="collapseall.gif" 
		sicon="expandall.gif" type="toggle" help="true" />
		
	<!-- ToolBar List for header area -->
	<action-list id="replaydh.ui.core.workflowGraph.toolBarList">
		<!-- <item type="label" value="replaydh.panels.workflowGraph.title" /> -->
		<item type="custom" value="workflowTitle" />
		<item type="glue" />
		<item type="action" value="replaydh.ui.core.workflowGraph.exportMetadata" />
		<item type="action" value="replaydh.ui.core.workflowGraph.exportResources" />
		<item type="action" value="replaydh.ui.core.workflowGraph.updateRepository" />
		<separator />
		<action-list id="replaydh.ui.core.workflowGraph.publishResources" help="true"
			name="${id}.name" desc="${id}.description" icon="icons8-epub-40.png">
			<item type="custom" value="publisherExtensions" />
		</action-list>
		<separator />
		<item type="action" value="replaydh.ui.core.workflowGraph.changeActiveStep" />
		<item type="action" value="replaydh.ui.core.workflowGraph.focusActiveStep" />
		<separator />
		<item type="action" value="replaydh.ui.core.workflowGraph.toggleCompressPipes" />
		<separator />
		
		<!--  
		<item type="action" value="replaydh.ui.core.workflowGraph.loadDummyGraph" />
		<separator />
		-->
		<item type="action" value="replaydh.ui.core.workflowGraph.refreshGraph" />
	</action-list>
	
	<action-list id="replaydh.ui.core.workflowGraph.popupMenuList">
		<item type="action" value="replaydh.ui.core.workflowGraph.changeActiveStep" />
		<separator />
		<item type="action" value="replaydh.ui.core.workflowGraph.compressStep" />
		<item type="action" value="replaydh.ui.core.workflowGraph.expandStep" />
		<separator />
		<item type="action" value="replaydh.ui.core.workflowGraph.exportStepMetadata" />
		<item type="action" value="replaydh.ui.core.workflowGraph.exportStepResources" />
		<!-- 
		<separator />
		<item type="action" value="replaydh.ui.core.workflowGraph.exportMetadata" />
		<item type="action" value="replaydh.ui.core.workflowGraph.exportResources" />
		 -->
	</action-list>
	
</actions>